text,label
hoạt động thuyết trình chiếm nhiều thời gian,0
hài lòng về chất lượng đào tạo môn học này,2
bám sát nội dung môn học,2
ngôn ngữ đã được học từ môn lập trình nhúng do mong dạy kiến thức mới hơn,0
đảm bảo giờ học tiết học nội dung,2
báo cáo đồ án cuối kỳ do sự phân công trong một nhóm ai cũng có điểm yếu điểm mạnh nên mới tạo thành một nhóm giúp đỡ nhau nhưng làm khó các thành viên,0
cần có nền tảng trước xây dựng cả một website,0
ít bài tập hay,0
đúng anh văn rất cần thiết chúng nhưng không phải những gì cần một môn ngoại ngữ cần cảm giác thích thú học tiếng anh,0
đảm bảo giờ giấc lên lớp,2
khả năng truyền đạt chưa tốt,0
nhiệt tình dễ hiểu đúng giờ,2
cơ sở vật chất trường còn khá kém thiếu các hoạt động ngoại khóa,0
chia sẻ các kỹ năng làm việc chia sẻ kinh nghiệm trong ngành thậm chí chỉ cách mua linh kiện không bị chặt chém giá cả,2
không nhiệt tình phương pháp truyền đạt kiến thức gây khó hiểu,0
cách dạy hay tạo động lực,2
ít giảng chủ yếu chép vào vở,0
không nên nói bồi nói đan xen quá nhiều tiếng anh vào trong bào giảng thế rất khó hiểu không hiểu rõ nghĩa từ gì,0
hòa đồng vui vẻ,2
giảng bài kỹ dễ hiểu,2
nên giảng dạy chi tiết hơn,0
tạo ra sự ganh đua trong mỗi buổi thực hành,0
giảng buồn ngủ,0
dạy giỏi quan tâm tới,2
dạy hay,2
dạy nhàm chán buồn ngủ,0
rất hiền nhiệt tình,2
tiết cuối ôn bài không đề mẫu cuối kỳ,0
khả năng truyền đạt không được tốt lắm,0
dạy cực kỳ nhiệt tình hiểu tâm lý cách giảng bài hay,2
từ bọn khó có được nhiều kiến thức về môn học này,0
đảm bảo thời gian lên lớp tốt chấm điểm công bằng,2
nói lan man,0
nhiệt tình dễ hiểu dễ thương,2
thường xuyên lên lớp rất muộn không cung cấp đề cương môn học chấm điểm chủ quan thường xuyên nặng lời,0
có nhiều phương pháp giảng dạy hay nhiều cách giúp hoàn thành bài tốt,2
nên tăng cường các bài tập về nhà,0
giảng dạy hay dễ hiểu,2
giống không muốn nghe nữa thời gian báo cáo phút nhưng chưa kịp nói gì nói chuyển được khoảng phút xong không báo cáo nữa,0
kiến thức hơi nhiều,0
chưa thật sự vững ngữ pháp,0
dạy rất có tâm chuyên môn tốt smile,2
kéo dài thời gian buổi học phút nhưng không làm buổi học thêm hiệu quả,0
liên hệ kiến thức chuyện thực tiễn,2
giảng dạy nhiệt tình phát âm rất tốt ngữ pháp rất chuẩn,2
tại sao,1
môn học này không cần thiết nó không cung cấp được điều gì rõ ràng bổ ích,0
dạy rất kỹ,2
môn học nên tự chọn thay bắt buộc,0
tận tâm giúp đỡ không hiểu bài,2
các hoạt động giảng dạy trên lớp khá phong phú hay,2
cần nên bài tập về nhà,0
đa phần không tập trung học nhiệt tình nên không theo kịp,0
theo hơi thụ động một tí,0
tài liệu bằng tiếng việt,1
thường nghỉ đột xuất nhiều phương pháp dạy chưa cuốn hút khiến chưa thể tập trung vào việc học,0
rất hòa đồng vui vẻ nhiệt tình trong giảng dạy,2
nhiều bài tập hay,2
biết lắng nghe ý kiến từ,2
vui vẻ nhiệt tình thân thiện,2
giảng dạy rất nhiệt tình kiến thức sâu rộng,2
nói nhiều trên tài liệu có nhiều ví dụ cụ thể dễ hiểu hơn,0
kinh mong nhà trường làm rõ việc này đảm bảo công bằng,0
thời gian deadline lâu rất thích,2
dạy tốt giảng dễ hiểu,2
bảo đảm giờ lên lớp số tiết dạy,2
nên có bài viết hoặc bài tiểu luận mỗi tuần trên khóa học thực tập,0
nói chung lần nữa,2
chuyên nghiệp trong cách giảng dạy rất nhiệt tâm,2
trong thời gian báo cáo không lắng nghe góp ý hỏi những câu ví dụ chỉ có thôi hả còn gì nữa không,0
nhiệt tình giúp đỡ,2
cực nhiệt tình thương giảng dễ hiểu,2
tận tình hay giúp đỡ,2
nhiệt tình dạy dễ hiểu,2
nên thực hành theo hình thức,0
ra hiền chăm lo,2
phòng thực hành có rất nhiều máy bị hư hỏng không thể sử dụng chuột được phiên bản cũ quá không còn phù hợp học tập nữa,0
nâng cao chất lượng cơ sở vật chất trường,0
sử dụng kiến thức có tính thực tiễn cao hơn kiến thức có thể áp dụng vào trong thực tiễn,0
phong cách dạy hiệu quả,2
có những hoạt động giúp giờ động,2
giúp biết mạch số gì,2
cần thay đổi hệ thống máy tính ở một số phòng thực hành đã quá cũ,0
chưa thật sự dễ hiểu,0
nên cài các phiên bản mới hơn,0
nên nói chậm một tí,0
truyền đạt nhiều kiến thức mở rộng,2
tài liệu cần cập nhật hơn nữa,0
giúp xác định được mục tiêu mong muốn đạt được học môn học này,2
không nên hù dọa ở phía trước mỗi bài toán phải biến nó thành đơn giản thực thi bài toán cần phải làm những bài tập mẫu hơn mấy trăm bài tập,0
có nhiều ngại trong việc hỏi bài nên sẵn sàng giúp đỡ làm bài tập một cách nhiệt tình vui vẻ hơn đôi cần,0
truyền đạt kém khó hiểu,0
giảng dễ hiểu đơn giản ngắn gọn phần ôn tập bài cuối kỳ rất ấn tượng giúp năm bắt được học gì,2
nên chú trọng đến truyền đạt nhiều hơn,0
cần đổi máy chiếu,0
tận tâm kiến thức tốt khả năng truyền đạt tốt,2
các deadline thời gian hơi ít,0
rất dễ thương được nhiều yêu quý ạ,2
rất ít nổi nóng,1
thay đổi đề cương môn học phù hợp tình hình thực tế hiện nay có thể áp dụng liên hệ thực tế,0
trẻ thân thiện nhiệt tình,2
cần thêm nhiều video demo hướng dẫn thực hành các quy trình chất lượng học môn này cao hơn,0
dạy chậm hơn tiết thực hành,0
học cực kỳ áp lực dạy khó hiểu,0
dạy sát chương trình truyền đạt được kiến thức,2
nhiệt tình quan tâm đến hiền,2
thân thiện giải đáp thắc mắc định hướng nghiên cứu một cách nhiệt tình,2
giọng nghe không được,0
về phương pháp giảng dạy cách truyền đạt,1
bài tập làm không chắc chắn không biết đúng hay sai,0
giảng rất cận kẽ hơi chậm,0
tận tâm dạy hết tất cả mọi thứ có,2
dạy hay tiết học sôi động vui nhộn nhưng vẫn đảm bảo kiến thức dành,2
sửa chữa những thiết bị máy tính hư trong phòng máy,0
chưa gặp lần nào,1
ngoài ra còn nói về một số kiến thức thực tế liên quan đến môn học,2
dạy dễ hiểu quan tâm đến,2
bài giảng mang tính thực tiễn ứng dụng cao,2
đề nghị nên sử dụng hệ thống nhiều hơn,0
đưa ra nhiều ví dụ cụ thể minh họa bài giảng giúp phân biệt rõ các khái niệm nắm bắt bài học,2
học bên về nên dạy tiếng anh rất tốt,2
vui tính dễ chịu,2
giảng bài dễ tiếp thu,2
cần thể hiện chi tiết hơn nội dung môn học nhiều ví dụ minh họa hơn,0
dạy hay rất đúng giờ dạy học,2
giọng to rõ ràng dễ nghe ở dưới nước,2
có thêm nhiều tài liệu thực hành hơn,0
giảng tận tình,2
nhiệt tình đúng giờ thân thiện,2
dạy rất hay dễ hiểu sôi động điểm nhỏ chỉ đề thi khó hơn đề mọi năm,2
gửi email nhưng có lẽ bận nên không thấy trả lời,0
truyền đạt dễ hiểu tận tình,2
cách giảng bài chưa thu hút được nhiều,0
ngoài ra còn rất rất nhiều mặt tốt không thể kể hết,2
nhiệt tình chỉ dạy tận tình,2
giảng bài hơi khó hiểu không có tài liệu tham khảo trên,0
giảng bài rất nhiệt tình,2
cung cấp tài liệu rất đầy đủ tận tụy,2
thân thiện dễ tiếp thu hơn,0
cần có tài liệu bài bản rõ ràng,0
giảng bài làm hứng thú dễ tiếp thu,2
dạy nhiệt tình giảng bài chi tiết,2
toàn bộ các đều phải tự mang laptop lên phòng thực hành học nhiên mạng đáp ứng nhu cầu sử dụng nhiều laptop trong phòng thực hành không có,0
nghĩ không nên chấm chéo đồ án mỗi người một kiểu hầu hết ai cũng lo đồ án nên việc chấm chéo diễn ra rất khó khăn gấp gáp nên chấm có thể không chính xác mấy,0
dạy chưa tập trung dạy thực hành không giảng giải nội dung thực hành,0
nên nói trước về cách chấm điểm bài thi,0
chu đáo nhiệt tình trong giảng dạy,2
cách dạy khó hiểu,0
không ôn tập cũng cấu trúc đề thi,0
mong muốn chứ không phải không hài lòng,1
chưa tận tụy,0
học ngồi ở nhà lên mạng làm bài cũng được,0
bận nhiều nên cũng nghỉ nhiều hi vọng có thể sắp xếp thời gian,0
thích cách dạy,2
giảng rõ ràng dễ hiểu,2
luôn vui vẻ tận tình giúp đỡ,2
nên chú trọng vào việc giảng hơn,0
tận tình truyền đạt kiến thức biết cách làm lớp học không bị nhàm chán giúp có hứng thú học hơn ngoài ra còn có các trò chơi áp dụng kiến thức giúp hiểu hơn về vấn đề mới học,2
không được cung cấp nhiều tài liệu môn học ngoài tài liệu cung cấp,0
buổi chiều nên học lúc,0
chưa có gặp lần nào nữa ạ,0
vui vẻ giảng dạy tận tâm,2
nên có thêm nhiều buổi thực hành về website,0
đầu học kỳ có thông báo cuối kỳ làm đồ án nhưng đến giờ sắp cuối kỳ không hề có thông tin gì về đề tài đồ án cuối kỳ,0
cực kỳ nhiều bài cực kỳ khó luôn,0
làm bị thiệt thòi,0
dạy tận tình truyền đạt tốt,2
hy vọng cải tiến làm hoạt động sôi nổi hơn,0
có nhiều bài tập hay rèn luyện kỹ năng tốt,2
truyền đạt đúng những mục đích các buổi học,2
dạy rất nhiệt tình tận tâm cách dạy dễ hiểu,2
cố chấp,0
vui tính có sửa bài tập đầy đủ,2
nhiệt tình tận tâm,2
truyền đạt kiến thức tốt dễ hiểu,2
rất ít người học thực hành môn cấu trúc dữ liệu giải thuật,0
lượng kiến thức cần học quá dài khó tiếp thu,0
dạy đôi hơi chán cần thay đổi phương pháp giảng dạy,0
cần có tài liệu đọc thêm tự học,0
rất tốt truyền đạt đầy đủ kiến thức tới,2
chất lượng môn học rất tốt,2
chương trình học khá nặng so khoa khác seminar bài tập về nhà đồ án lớn thi cuối kỳ,0
hoạt động giảng dạy logic dễ hiểu không có gì ý kiến,2
giảng siêu hay,2
có lòng nhiệt thành nhưng theo khả năng truyền đạt không được tốt dẫn đến không hiểu có lòng nhưng không thể tiếp thu được nên mong sao có thể truyền đạt một cách dễ hiểu nhất có thể áp dụng làm bài tập ngay trong giờ lý thuyết dễ hiểu hơn,0
nên chú trọng hơn về giao tiếp tiếng anh,0
theo nghĩ đã làm đồ án môn học không nên thi cuối kỳ thi cuối kỳ nên bỏ đồ án môn học,0
dạy hay nhiệt tình,2
hình thức thực hiện chưa chuyên nghiệp máy móc,0
nhiệt tình vui vẻ giờ học vui,2
giảng bài hay hiệu quả,2
nhiệt tình trong giờ lên lớp cũng kiểm tra email,2
đề thi quá khó so bài tập trên lớp,0
bài tập deadline quá nhiều thời gian quá ngắn,0
sử dụng tài liệu máy chiếu,0
giảng bài giải bài còn quá nhanh,0
cung cấp kiến thức đầy đủ,2
dạy buồn ngủ khó hiểu,0
cung cấp đủ bài tập đến lớp cũng làm ở nhà,2
rất nhiệt tình quan tâm tới kiến thức,2
dạy hơi chậm,0
dạy dễ hiểu tận tâm,2
tài liệu môn học hoặc các tài liệu cần rõ ràng hơn nữa nhiều phần rất khó hiểu nhưng rất ít kiến thức về nó làm không thể hiểu được bản chất bài,0
tận tâm chu đáo luôn theo sát giúp đạt kết quả tốt trong môn học,2
sự nhiệt tình vui tính,2
thường xuyên dạy lố giờ,0
nâng cao chất lượng cơ sở vật chất,0
cần giảng kỹ hơn hiểu bài có kết hợp nhiều ví dụ minh họa thực tế,0
truyền đạt kiến thức mập mờ,0
sắp xếp lịch ở nhiều tiết không phù hợp tiết khiến rất nhiều không tham gia được,0
dạy cứng nhắc nhanh,0
môn học chỉ có tiết nên kiến thức vẫn chưa truyền đạt hết thời gian phân bố môn học chưa hợp lý lắm sáng học tiết chiều học tiết,0
nên thêm nhiều phần đọc,0
nợ môn này nhưng học ở các học kỳ kế tiếp,1
xin chân thành cảm ơn xin lỗi máy không dùng được,2
không thích,0
tạo nhiều bài tập câu hỏi mỗi thành viên trong lớp đều có thể tương tác,2
bài tập hay,2
học anh văn không nên quá theo một khuôn mẫu,0
nói to chậm rãi dễ hiểu truyền đạt nhiều kiến thức quan trọng có tính thực tế,2
chưa thấy được sự cần thiết thực sự môn học ngành nghề cũng cuộc sống sau này,0
do ra trường các công ty chủ yếu đánh mạnh phần thực hành vận dụng,1
nên quan tâm nhiều hơn đến mức hiểu bài qua mỗi giờ học bằng cách hỏi những câu hỏi liên quan ở cuối giờ qua cộng điểm tạo thêm sự yêu thích môn học,0
phải nghe những thứ chưa được thấy thật khó tiếp thu,0
dạy lý thuyết suông quá ạ,0
thường nghỉ không lý do cả lớp lên ngồi đợi rất lâu có người lên thay báo nghỉ hoặc thường xuyên đi trễ trên phút lý do kẹt xe,0
dạy nhiệt tình kiến thức sâu rộng liên hệ thực tiễn cụ thể,2
do cửa sổ không có rèm cửa nên học bằng máy chiếu không có hiệu quả cao hơi mờ khó khăn trong việc nhìn,0
cùng một kiến thức nhưng cách truyền đạt dễ hiểu hơn phù hợp đại đa số tất nhiên hữu dụng các môn khác chứ không hề lan man thiếu trọng tâm các toán khác,2
phòng thực hành máy bị treo bị hư hoài dây mạng cắm lúc nhận lúc không,0
dạy khá chắc chắn,2
seminar lung tung không rõ ràng,0
có nắm được lý thuyết môn học,1
mở máy lạnh lạnh quá ạ mong bật máy lạnh vừa phải thôi,0
môn học giúp nắm rõ các phương pháp kỹ năng cần thiết tổ chức cơ sở dữ liệu sử dụng nó một cách hiệu quả ở mức cơ bản dữ liệu không lớn,2
thường chia sẻ rất nhiều bài viết nghiên cứu khoa học các sản phẩm ứng dụng thực hiện,2
tích cực lên lớp không nghỉ buổi nào,2
hết sức tích cực trong việc dạy,2
chỉ có vấn đề dạy hơi nhanh,0
bài thực hành khó nhiều,0
rất ít thấy đến phòng thực hành,0
cảm thấy có lộ trình áp dụng phương pháp này một cách cụ thể nên áp dụng còn không cứ theo phương pháp truyền thống đi ạ,0
dạy giải bài tập nhiều cả lớp có những buổi ôn tập ngoài giờ động viên nhắn những hay vắng cố gắng đi học đầy đủ smile,2
hướng dẫn rất nhiệt tình chi tiết,2
dạy nhanh dẫn đến nhiều lúc khó hiểu,0
mời bản xứ tham gia giảng dạy có thêm cơ hội phát triển các kỹ năng cơ bản trong anh văn,0
dạy tận tâm nhiệt tình vui tính,2
nên biên soạn một tài liệu chính trường ta,0
phòng máy không đáp ứng được yêu cầu,0
vui tính giảng dạy rất nhiệt tình,2
rất cảm ơn,2
nói khó nghe nên đôi lúc không nghe được đang nói gì,0
dạy chậm giúp dễ hiêu nhiên nhiều bài khó khiến dễ chán,0
giảng nhanh cách truyền đạt hơi khó hiểu đưa ra khá ít ví dụ có thể hiểu bài rõ hơn,0
vui vẻ nhiệt tình tận tụy,2
môn học không mang tính ứng dụng thực tế kiến thức quá chung chung,0
nhiệt tình tận tâm luôn tận dụng tối đa giờ học trên lớp kiến thức truyền đạt tốt vui vẻ hòa đồng,2
nhiệt tình vui tính dễ hiểu,2
giảng bài hay hài hước,2
bài thực hành khó so những kiến thức đã học ở lý thuyết,0
nhiều lúc muốn học đọc tài liệu khó hiểu lên mạng kiếm không thấy,0
có lấy nhiều ví dụ liên hệ thực tiễn,2
sử dụng giờ lên lớp không hiệu quả do không tập trung dạy bài kỹ lưỡng khả năng truyền đạt không tốt,0
nên bổ xung nhiều bài tập hơn,0
cải thiện thiết bị lớp học máy chiếu ổ điện quạt,0
cần chú trọng hiệu quả môn học đảm bảo có thể giao tiếp được,0
dễ gần phương pháp dạy dể tiếp thu,2
hầu không có điều không hài lòng,1
tích cực chủ động giải những ví dụ rất nhiều dễ hiểu,2
dạy tận tâm nhiệt tình nói tiếng anh hay dễ hiểu thỉnh thoảng còn giảng song ngữ nắm rõ hơn bài tập thực tế dễ hiểu,2
dạy không tạo được sự hứng thú,0
dạy rất nhiệt tình được làm bài tập ở lớp nhiều sửa chỉ dẫn tận tình tạo không khí học tập thoải mái,2
truyền đạt dễ hiểu dễ nhớ,2
hạn chế sử dụng tiếng việt,0
trường rất may mắn có một người vầy,2
rất tận tâm,2
nghỉ giờ lên lớp quá nhiều,0
tận tình giảng dạy tốt,2
cung cấp nhiều bài tập tham khảo,2
khiến bị thụ động,0
bài tập đưa ra nhiều khó tìm hiểu kiến thực hiện tại khó có thể tìm hiểu làm tốt bài tập ra,0
lý thuyết quá nhiều làm nhiễu thông tin,0
nguồn tài liệu tự học không nhiều,0
nhà trường nên cập nhật thêm nhiều thông tin kiến thức mới vào đề cương giảng dạy,0
nhiều điều dạy hơi nhanh nên làm thêm nhiều bài tập nữa,0
dạy hay tận tâm,2
rất nhiệt huyết trong việc giảng dạy,2
nhiệt tình tận tâm công việc tài liệu dễ hiểu,2
kiến thức,1
dạy hơi chậm chút,0
nhiệt tình tư tưởng thoải mái,2
nên bài tập làm thêm,0
nhiệt tình dạy dễ hiểu quan tâm đến,2
lên lớp đầy đủ giảng dạy nhiệt tình,2
cung cấp tài liệu trước có tư liệu tìm hiểu trước ở nhà,2
rất vui tính giảng bài tận tình,2
phần này khó nên giảng nhiều hơn,0
có tâm huyết nghề,2
chỉ đến hỗ trợ cần giúp,0
tính thực tiễn môn học,1
tăng thời gian nghe tiếng anh,0
theo chủ quan cá nhân người truyền đạt kiến thức tốt nhất từ trước tới giờ so những từng biết,2
cung cấp thêm thiết bị phục vụ nhu cầu môn học,0
chỉ dẫn tận tình,2
giảng dạy quá nhanh,0
phòng lab bị máy cấu hình không đủ chạy máy ảo,0
truyền đạt chính xác những kiến thức cần thiết môn học,2
tận tâm giảng bài giảng dễ hiểu đúng chương trình học,2
nhiệt tình,2
dạy rất chất chưa thấy nào dạy hay hơn,2
giờ lên lớp đều đặn tích cực giải đáp thắc mắc,2
thường xuyên nghỉ học,0
nhìn chung dạy tốt,2
rất dễ thương,2
cách diễn đạt đôi lúc còn khó hiểu,0
chu đáo tỉ mỉ,2
rất nhiệt tình truyền đạt tốt,2
giảng dạy tích cực vui vẻ,2
cần có một bộ tài liệu cụ thể cải thiện chất lượng lớp thực hành,0
giảng hay giúp tiếp thu kiến thức hiệu quả,2
qua dạy làm thiếu thời gian nhưng hầu dậy rất kỹ,2
tận tâm nhiệt tình bài giảng khá kỹ,2
nên thêm nhiều bài tập thực hành trên lớp cũng bài tập ôn tập thi các kỳ,0
dạy tốt rất nhiệt tình chỉ dạy hoc sinh,2
hình dung chưa,1
bài tập trên lớp nên được giới thiệu ngay từ đầu tiết học không tốn thời gian đọc đề cũng có thể suy nghĩ cách giải cùng lúc việc nghe giảng,0
hình thức điểm danh,0
thích,2
nâng cấp thiết bị phòng học máy chiếu quạt,0
dạy nhiệt tình giải đáp thắc mắc một cách tận tình,2
bài tập khắt khe,1
những ví dụ thực tế rất sống động,2
ân cần giải đáp thắc mắc,2
cần xem xét đặt ra những yêu cầu về chấm chéo đồ án các nhóm cũng trong lớp quá nhiều yêu cầu nhiều việc phải làm trong thời gian ngắn dẫn đến sự chuẩn bị không tốt từ các nhóm,0
truyền đạt kiến thức rất tốt tạo hứng thú,2
dạy rất kỹ rất nhiệt tình thêm giờ hoàn thành xong bài giảng hỏi han nói chung rất tuyệt,2
nào khá có thể áp dụng công thức vào bài tập cả lớp chưa đến còn thực sự hiểu môn học rất ít người hiểu,0
chúc vui sống khỏe,2
cần nhiều bài tập làm ở nhà,0
chưa thể hình dung tiếp thu hết được tất cả nội dung,0
dạy học rất tâm huyết,2
giảng giải bài quá nhanh,0
nhiệt tình giúp đỡ rất nhiều,2
phòng quá nóng chói làm máy chiếu bị mờ,0
tổ chức tham quan doanh nghiệp,2
nhiệt tình chu đáo,2
hơi khô khan trong việc giảng dạy,0
nghĩ nên up tài liệu trước mỗi buổi học có thể xem bài trước ở nhà thay up tài liệu sau mỗi buổi học ạ,0
dạy có tâm,2
nên sử dụng microphone giảng bài,0
dạy rất kỹ rất chi tiết,2
dạy sát chương trình,2
tận tình giảng dạy,2
chắc gì những gì nói đã đúng,0
đầu tư thêm nhiều thiết bị,0
môn học rất hay bổ ích,2
dạy rất hay có kiến thức sâu rộng,2
dạy rất có tâm chấm điểm rất chính xác,2
thưa luôn đưa ra những bài tập mang tính thực tiễn rất cao giúp những bài giảng vốn mang tính lý thuyết dài dòng không nhàm chán,2
cung cấp thêm tài liệu môn học sử dụng hợp lý giờ giảng trên lớp,0
lớp ồn ào,0
có năng lực tốt kiến thức thực hành xuất sắc nhiệt tình giải đáp thắc mắc,2
giảng viên rất thân thiện,2
cũng người đóng học phí,0
dạy dễ hiểu nhiều ví dụ sinh động,2
sau mỗi phần lý thuyết đều bài tập bài học trở nên rất dễ hiểu tạo cơ hội áp dụng những kiến thức vừa được học,2
dạy nhanh quá ít bài tập về nhà,0
không áp lực học tập,1
chỉ nên làm những bài tập vừa ngắn trong quá trình làm bài tập giúp đỡ những chưa hiểu bài không bỏ ra ngoài,0
nên sắp lịch học phù hợp,0
giảng bài chậm một chút,0
rất hay liên hệ nhưng thứ học được ra thực tế những ứng dụng các linh kiện,2
rất tận tâm vui vẻ,2
học lý thuyết khác hẳn thực hành học nhiều buổi thực hành nhưng chỉ bài thực hành về sân bóng đa số không hiểu đề,0
tận tâm rất nhiệt tình ngoài ra cũng khá hài hước,2
tận tình chỉ dạy,2
dạy quá số giờ quy định,0
am hiểu sâu giảng bài tận tâm,2
trong học kỳ này nó không được cố định nên có thể nhiều khác đã bỏ lỡ bài nộp,0
giảng rất nhiệt tình,2
có lẽ thế đồ án lớn bài tập theo tuần nữa nên khá căng thẳng còn phải làm đồ án các môn khác nữa,0
bài giảng dài không quá hứng thú học,0
phong thái,1
nhiều hỏi phải coi cái đề coi xong còn nói chắc cái này cứ thử đi,0
ngoài ra môn này đánh giá đồ án cuối kỳ chỉ nên đánh giá vào cách trình bày tài liệu báo cáo cách báo cáo cách thuyết trình,0
chắc không có gì không hài lòng về,1
giải tích,1
chuyện lớp ồn cũng tìm cách nói tránh mất lòng,2
tài liệu còn hơi khô khan cách giải thích còn chưa thuyết phục dễ hiểu,0
nhưng ra đề rất khó,0
nên hướng dẫn kỹ lưỡng vào những vấn đề trọng tâm,0
các máy trong phòng máy đã hết hạn,0
quá cứng nhắc trong quá trình điểm,0
truyền đạt kiến thức rất hiệu quả,2
nguyên tắc phương pháp giảng dạy tốt,2
nhiệt tình quan tâm đên hơn,0
chúc có một học kỳ khác thành công hơn môn học hiện tại,2
không có tài liệu,0
dễ gần tận tình,2
lập trình nói riêng tất cả các môn liên quan đến lập trình nói chung theo nên được cập nhật tài liệu thường xuyên đặc biệt các phần mềm trong các phòng lab tránh tình trạng các tài liệu phần mềm hỗ trợ học tập lỗi thời gây khó khăn việc giảng dạy học tập,0
té cũng đau,0
dạy rất hay rất nhiệt tình,2
giao bài tập quá nhiều,0
