text,label
dạy dễ hiểu sinh động,2
hình thức báo cáo đồ án cuối kỳ không thể hiện được khả năng dễ xảy ra trường hợp một người làm cả đám người hưởng không yêu cầu bảng phân công công việc chỉ chấm điểm chung cả nhóm dựa trên bài báo cáo được nộp mặc một nhóm quy định người,0
chấm điểm thực hành cần xem xét khó đạt điểm cao,0
chỉ biết nhiều điều cốt lõi trong môn học ít ai biết,2
thực hành không hài lòng không biết chút gì về bài thực hành số nhưng đâu có cơ hội nào biết về chúng trước,0
chỉ làm bài tập dựa trên tài liệu tìm kiếm trên mạng,0
nhiệt tình truyền đạt tốt hướng dẫn tận tình,2
tiền họ họ muốn dùng tùy họ người khác nghèo không phải lỗi họ chưa kể tiền thuế họ đóng góp nước cũng đủ gọi xây dựng,0
tận tâm giảng dạy,2
luyện tập tốt,2
giảng dạy đúng giờ hiệu quả,2
lên lớp không đều lắm,0
cảm giác hơi chán,0
giản viên không có tương tác đọc tài liệu xong về,0
không vận dụng thời gian hợp lý,0
luôn giải đáp thắc mắc dạy dễ hiểu,2
thứ hai về cách chấm điểm quá trình về bài dễ chỉ nhìn sơ qua bài viết đếm số dòng nhìn chữ đẹp hay xấu điểm chữ đẹp nhiều chữ điểm cao ngược,0
nói rõ ràng dễ hiểu,2
nên tăng thêm số bài làm thực tế ví dụ bấm cáp đã được học,0
vui tính nhiệt tình,2
tiếng nói,1
phong cách giảng dạy hay lôi cuốn,2
rất cảm ơn ạ,2
giảng dạy tận tình đi đúng giờ,2
tài liệu giảng dạy còn cứng nhắc không linh hoạt đời sống thực tế xã hội,0
bài tập áp lực quá,0
thương hài hước lấy ví dụ thực tiễn biết phân bố hợp lý giờ giảng dạy xen lẫn trò chuyện cùng,2
không dạy,0
giảng dạy qua loa thiếu nhiệt tình chương trình học hoàn toàn không ăn khớp lý thuyết,0
truyền đạt kiến thức rất tốt dễ tiếp thu,2
nên đưa thêm các đoạn video ngắn luyện cách nghe được tốt hơn,0
giảng dễ hiểu,2
đảm bảo giờ lên lớp tận tâm,2
nhiệt tình phương thức truyền đạt dễ hiểu,2
cần thay đổi tài liệu phù hợp kiến thức,0
khả năng truyền đạt kiến thức cao thường hay gọi lên bảng kiểm tra năng lực,2
cách dạy còn khô khan nhàm chán không tạo được sự hào hứng,0
giảng dễ hiểu nhiệt tình,2
nghỉ học nhưng không thông báo biết,0
rất nhiệt tình trong việc truyền đạt kiến thức cũng sẵn sàng trả lời mọi thắc mắc,2
nhiệt tình truyền đạt tốt kiến thức giới thiệu thêm nhiều nguồn tài liệu,2
chỉ bảo tự tìm hiểu,0
phòng học còn thiếu chất lượng trời nóng nên bố trí thêm quạt dãy hai bên phòng,0
thoải mái thân thiện,2
nhiệt tình hướng dẫn cụ thể,2
tận tâm nhiệt tình thân thiện hướng dẫn ân cần theo sát năng lực học tập,2
tiếp thu bài cũng ổn,1
rất có tâm tạo điều kiện tham khảo,2
nhiệt huyết có tâm tận tình chỉ dạy,2
nâng cấp thiết bị dạy học môn anh văn,0
nhiệt tình tài liệu post đầy đủ trên mạng,2
tài liệu cụ thể hơn,0
mong lên lớp tập trung vào môn học hơn không đưa ra những ví dụ lạc đề những chuyện không liên quan trong giờ học,0
không chỉ dạy kiến thức còn dạy những kỹ năng thuyết trình phản biện đặt câu hỏi làm việc nhóm,2
nguyên tắc tận tình giảng dạy,2
giảng hay nhiệt tình,2
dạy chưa hết chương trình học nghỉ không thông báo trước nghỉ không dạy bù,0
nội dung giảng dạy quá nhiều so thời lượng môn học,0
bài tập cần thực tiễn hơn giống bài toán chi tiết máy bài toán tính tiền lương thay những khái niệm toán học,0
dạy chỉ trong tài liệu không bổ sung kiên thức hay giải bài tập,0
luôn đúng giờ,2
nên giảng dạy kèm áp dụng thực tế nhiều hơn,0
nên có tài liệu song ngữ cả tiếng anh tiếng việt,0
tài liệu mới,1
không điểm danh,1
hay chảy mồ hôi nhìn có cảm giác nóng nực dễ sợ luôn,0
nhiệt tình biết cách truyền đạt,2
nhiên bản chất môn học vẫn chán nên dạy rất hay nhưng cũng khó theo được,0
tích cực thuyết trình bằng tiếng anh,2
chưa đảm bảo giờ lên lớp,0
giảng hay minh họa sinh động,2
nên giảm thời gian tiết học môn anh văn thời gian học một buổi dài ít hiệu quả,0
cảm giác thiếu thiện cảm,0
cơ nghĩ phải hơn cả tuổi ba,1
dạy hay dễ hiểu vui tính rất hài lòng về môn học do dạy xin cảm ơn,2
cải thiện chất lượng quạt phòng rất nóng hầm bí,0
truyền đạt có cảm hứng hướng dẫn học tập thế nào sau ra trường xin việc,2
giảng dạy rất tận tâm,2
một môn khó do cần liên hệ thực tiễn có thể hiểu rõ ý nghĩa môn học,0
chỉ có dạy cảm thấy học thi không ăn nhập gì nhau,0
dạy lôi cuốn cung cấp nhiều kỹ năng nghề nghiệp,2
không cần phải đi học thực hành trên phòng máy nhiều,0
truyền đạt kiến thức sát thực tiễn giúp dễ hiểu,2
cần cải cách nội dung các bài thực hành một số kiến nội dung trong bài thực hành đã trở nên lỗi thời,0
kiến thức không áp dụng được nhiều thực tế,0
chân tình giảng dạy tận tình,2
không có ý kiến chất lượng môn học vừa đủ mọi,1
dạy giải đáp nhiệt tình,2
dạy kỹ sát đề thi,2
giảng tận tình,2
dạy tốt tận tình tài liệu đầy đủ,2
dạy hay nhiệt tình,2
theo lý thuyết quan trọng nhưng cơ bản sau học xong có thể làm được gì mới điều quan trọng nên có đề xuất tăng tỷ lệ điểm về phần thực hành lên mức tối đa có thể đánh giá được kết quả học tập,0
có lúc dạy khó hiểu,0
nhiều băn khoăn rất lâu ở phần mô hình,0
tận tâm tận tình,2
gần gũi,2
những không chịu học lơ từ trước giờ vẫn qua hai môn một cách dễ dàng thậm chí còn đạt được điểm cao do đề cơ bản còn được sử dụng tài liệu laptop,0
thường xuyên tương tác trong lúc dạy,2
nghỉ nhiều,0
trẻ mới ra trường nên rất nhiệt tình,2
kiểm chứng phần mềm một môn học khó nên thực hành cần phải liên hệ thường xuyên phải được gặp hướng dẫn thường xuyên,0
không nói ra điểm khác biệt làm lab trên hai hệ điều hành này,0
rất tận tâm quan tâm rất nhiều ngoài giờ trên lớp cũng có thể hỏi bất kỳ nào giúp đỡ rất khoa học nhiệt tình,2
đảm bảo giờ lên lớp số tiết dạy,2
ít quan tâm,0
giọng rất khó nghe cả lớp gần không ai nghe hiểu được,0
rất nhiều bài tập trên hệ thống giảng dạy rất lý thú vui vẻ,2
sáng tạo,2
dễ nói chuyện vui,2
dạy tận tâm giúp đỡ phương pháp giảng dạy đạt hiệu quả,2
không lớp ôn tập nội dung thi ở kỳ kiểm tra giữa kỳ cả thi cuối kỳ,0
dạy dễ hiểu dễ tiếp thu nhiệt tình tâm huyết bài giảng,2
dạy rất tận tâm dễ hiểu,2
chấm điểm khá gắt,0
chỉ cần bài tập qua website môn viên làm,1
người lần đầu tìm hiểu những yêu cầu đặt ra rất khó,0
phương pháp dạy trực quan dễ hiểu có nhiều hoạt động,2
thuộc các lớp phần mềm chất lượng cao hầu không ai muốn đăng ký môn học game cơ bản do này đảm nhận nhưng kỳ vừa nhà trường chỉ cung cấp duy nhất một sự lựa chọn này nên không còn cách nào khác,0
chưa có nhiều trao đổi tương tác trên các diễn đàn,0
khả năng truyền đạt giảng dạy chưa tốt,0
có lịch học bù đã tự sắp,2
bài tập khó ngay vừa giảng xong,0
cập nhật tính thời sự trong môn học cung cấp tài liệu đọc thêm bổ ích,2
bận lịch trường nên một vài buổi học không lên lớp được,0
có thể đi thăm quan nhiều công ty xem quy mô cách làm việc giúp hiểu rõ hơn vê ngành đang học,0
nhiệt tình năng động,2
dạy khá chi tiết giải bài tập nhiều,2
cách giảng dạy rất hay có phần dễ hiễu,2
rất mong phòng đào tạo biết được tên đăng ký môn học sau nay còn được học,0
nhưng nghĩ thời gian phòng học nên cố định hơn được thông báo rõ ràng,0
nhưng đổi được học cảm giác khác áp lực thiếu tự tin mệt mỏi sau mỗi buổi học một cơn đau đầu kéo dài,0
mặc nói khá nhiều kiến thức trên lớp học nhưng số lượng hiểu hết kiến thức cực kỳ ít,0
đầu tư vật chất có nhiều hoạt đông thú vị,2
thực hành không có học này da có thể nhầm lẫn gì chăng,0
chi tiết,1
rất vui vẻ dạy trên lớp,2
nên đổi tài liệu,0
ngoài copy paste ra không hướng dẫn gì thêm,0
tóm hoàn toàn không hài lòng về chất lượng giảng dạy,0
những kiến thức truyền đạt đầy đủ cần thiết,2
hướng dẫn thực hành kỹ lưỡng đảm bảo hiểu được cách làm,2
dạy sát kiến thức việc thi cử,2
nên chú trọng nhiều hơn vào kỹ năng giao tiếp nghe nói thay phần ngữ pháp,0
giảng dạy nhiệt tình truyền đạt kiến thức tốt,2
dạy nghiêm túc,2
cách truyền đạt cực hay,2
giảng nhanh quá chép bài không kịp không kịp hiểu,0
yêu cầu quá cao trong cái học được quá ít hầu không có gì ngoài việc dịch các cuốn sách không hiểu đúng sai trong đúng hay sai cũng không không được chỉ ra,0
sau việc giảng dạy quá tận tâm nên phần nào cũng nói đi nói từ buổi trở lên nên làm mất nhiều thời gian lên lớp giảng dạy,0
làm khó liên hệ giữa lý thuyết thực hành dẫn tới không hiểu đang được học gì,0
microphone hay bị hú rè,0
nói chuyện rất tự nhiên chia sẻ kinh nghiệm thực tế,2
thân thiện hay quan tâm tới,2
tận tâm nhiệt tình giải thích toàn bộ các câu hỏi đưa ra,2
bài giảng hấp dẫn gần gũi thực tế,2
bài giảng sống động,2
khá nhiệt huyết vui vẻ hệ thống kiến thức rõ ràng,2
máy tính trường nên nâng cấp,0
nhiệt tình truyền đạt kiến thức đến tốt,2
người rất có tâm,2
rất quan tâm đến tạo riêng một nhóm các trong lớp đặt câu hỏi cũng bài tập,2
điều hài lòng nhất tốc độ phù hợp rất dễ hiễu,2
khả năng truyền thụ tốt tạo cảm hứng học tập,2
lên lớp đầy đủ tận tâm nhiệt tình trong giảng dạy,2
cả buổi thực hành theo hình thức môn này có này tham gia hay hướng dẫn buổi nào đâu đánh giá chỉ có mỗi thôi,0
dạy dễ hiểu liên hệ các kiến thức tài liệu bằng tiếng anh bổ trợ bên ngoài,2
giải bài tập cần giải thích kỹ hơn lý do sao đáp án đúng hoặc sao sai biết nên sửa chữa chỗ nào hợp lý biết sai ở đâu,0
lớp thụ động nhàm chán,0
dạy rất tốt cảm ơn,2
có thể dễ qua môn hơn giải bài tập ít quá không hiểu sad,0
trẻ nhiệt huyết nhưng thiếu kinh nghiệm khuyến khích thực hành trên,2
đôi hơi buồn ngủ,0
mong có sự thống nhất giữa trong quá trình giảng dạy môn này,0
tận tình nhưng còn thiếu cách truyền đạt một chút,0
rất dễ tính dạy tận tình,2
chỉ làm việc,0
theo thời lượng môn học quá dài liên tục khiến mệt mỏi không tập trung học tốt được,0
nên tăng thời lượng thực hành đủ thời gian hướng dẫn thực hành hướng dẫn đầy đủ môn này môn quan trọng trước vào chuyên ngành,0
các công thức đã có sự đổi mới nên cần cập nhật thêm tránh áp đặt kiến thức lên,0
dạy nhiệt tình kỹ dễ hiểu,2
không chấm bài không nên bắt nộp bài lên,0
cập nhật những đổi mới về môn học nên có chương trình đào tạo phù hợp hơn,0
không riêng gì tất cả trong lớp cũng đều mong trường nhanh chóng bị hệ thống máy mới môn này ít nhất lõi tốc độ,0
thà ở nhà tự học còn tốt hơn đi nghe đọc tài liệu,0
thời lượng học lý thuyết môn học ngắn dễ bị ảnh hưởng đến trễ hay tham gia các buổi họp,0
việc truyền đạt kiến thức chưa sâu thấy vẫn mông lung sau mỗi tiết học chỉ hiểu sơ sơ,0
dạy cực kỳ đúng giờ,2
dễ hiểu rõ ràng,2
nhiều kinh nghiệm,2
giảng dạy tích cực,2
mong lên lớp nhiều hơn có định hướng rõ ràng về nội dung môn học tìm hiểu vã nắm rõ chúng,0
giảng dạy rất nhiệt tình,2
giảng bài dễ hiểu nhiệt tình,2
cách dạy cưỡi ngựa xem hoa phút giảng xong một bài,0
cung cấp được nhiều kinh nghiệm hay trong việc học cũng đi làm sau này,2
tận tình quan tâm,2
còn vài điều về bài học vẫn chưa được giải thích mọi hiểu,0
rất vui tính giảng dạy nhiệt tình chi tiết,2
rất thực tiễn,2
dạy rất vui rất kỹ,2
phần thực hành quá sơ sài trợ giảng thực hành chỉ đưa tài liệu tiếng anh đọc đưa bài về làm không có sự hướng dẫn,0
dạy rất hay kỹ nhiệt huyết,2
tài liệu không đầy đủ khó khăn xem kiến thức,0
đồ án thực tế quá khó,0
tạo hoạt động trong giờ học giúp cải thiện kỹ năng nhóm,2
thường xuyên đến lớp trễ quá phút thuyết trình không theo dõi được phần thông tin này,0
không thông báo những bữa dạy bù nghỉ lên,0
cần có phương pháp giảng dạy tốt hơn,0
chất lượng thiết bị hỗ trợ môn học chưa tốt cần được thay thế đổi mới,0
rất tận tâm nhiệt tình,2
dạy nhiệt tình truyền đạt kiến thức tốt,2
cần nhiều bài tập về nhà hơn nữa,0
nên nhiều bài tập về nhà,0
không quan tâm đến,0
vui vẻ dạy dễ hiểu,2
dạy nhiệt tình tận tâm,2
giọng nói hay,2
vui tính rất tâm lý,2
liệu có phải chuyên môn nghề nghiệp ngành công nghệ thông tin chúng ta,0
giảng bài dễ hiểu vui tính hòa đồng,2
mong phòng đào tạo xem xét khóa sau học được chất lượng ạ,0
giảng dạy nhiệt tình hăng say,2
thân thiện rất nhiệt tình,2
đưa ra các chỉ tiêu tính điểm cụ thể,0
một tâm huyết nghề,2
chịu khó,2
dạy thú vị nói chung ổn,2
giảng dạy nhiệt tình,2
giảng bài khó hiểu đôi còn mơ hồ,0
giảng dạy hay nhiệt tình dễ hiểu,2
truyền đạt kiến thức đầy đủ,2
thời gian deadline bài tập nên cuối ngày buổi dạy tiếp theo hiện nay trước ngày học có thể cần lên lớp trao đổi những vấn đề phát sinh trong lúc làm bài tập sửa đổi,0
hay đi trễ vài buổi đầu,0
môn học khá khó không phù hợp,0
giảng nhiệt tình dễ hiểu luôn tạo ra các hoạt động hỏi đáp giúp tăng khả năng xử lý tình huống sự sáng tạo,2
nhiệt tình giúp đỡ hiệu quả,2
dạy cả bài học lẫn cách học sao hiệu quả,2
chưa có demo thực tế,0
bài giảng khá hay có nhiều bài dễ mắc phải đều chỉ rõ ra,2
giảng dạy nhiệt tình dễ hiểu,2
thu hút,2
rất vui vẻ,2
thậm chí còn không có bài nào khó bằng các bài trong nội dung lớp chuyên tin ở các trường cấp,0
trình bày ý trong tài liệu rất chi tiết,2
tạo động cơ học tập lâu dài,2
tốc độ giảng dạy phù hợp có đủ thời gian tự thực hành kiến thức vừa học ngay tại lớp,2
chất lượng giảng dạy tốt tâm huyết nhiệt tình,2
thường xuyên lên lớp muộn khiến phải đợi,0
rất nhiệt tình,2
có nhiều kiến thức hay ngoài đề cương,2
chu đáo nhiệt tình,2
có rất nhiều thiết bị đang xuống cấp hư hỏng ảnh hưởng đến chất lượng giảng dạy,0
sự nhiệt tình chu đáo,2
số thời gian nghỉ rất nhiều không báo trước,0
tận tình giúp đỡ,2
môn học giúp hiểu rõ về từng ngành,2
nên cập nhật những nội dung mới vào môn học,0
đồ án khó liên quan tới nhiều nội dung chưa được học,0
hầu không tiếp thu được gì,0
nghĩ nhà trường không nên tổ chức học thực hành,0
chất lượng đào tạo tốt,2
có trình bày một số vấn đề thực tiễn hữu ích khích lệ những tích cực phong cách giảng dạy thân thiện có phần lãnh đạm dễ gây buồn ngủ,2
tâm huyết nhiệt tình chu đáo,2
dạy rất dễ hiểu,2
dạy hay dễ hiểu,2
bài tập hoạt động nhóm còn ít,0
thỉnh thoảng bù lịch học không nói ạ,1
giảng dễ hiểu có sửa bài tập mẫu các dạng đề,2
dạy hay nhiệt huyết tiết học vui nhộn dễ hiểu,2
dạy dễ tiếp thu tài liệu trình bày được vui tính dạy nhiệt tình tận tình trong công việc,2
nên thêm bài tập hướng dẫn giải,0
ít thấy xuất hiện,0
tận tâm nghề rất quan tâm đến luôn giải đáp những thắc mắc trong thời gian nhanh nhất kể cả qua email,2
nhà trường nên có nhiều tài liệu bài tập hướng dẫn giải bài tập nhiều hơn,0
dạy tương đối dễ hiểu,2
rất mong dùng tài liệu tiếng việt giảng dạy,0
chỉ dạy một buổi nên không đánh giá được,0
vui tính dạy tốt,2
dạy dễ hiểu đi dạy đúng giờ,2
bám sát thực tiễn,2
chữa bài tập đầy đủ nhiệt tình,2
tài liệu tài liệu đầy đủ,2
kiến thức hơi ít,0
giảng bài nhanh quá sad,0
còn ít bài tập,0
học những môn tiên quyết trước,0
do học kỳ này không thể đến lớp học môn này nên không thể đưa ra ý kiến gì thêm,1
đẹp trai,2
không dùng microphone giảng bài,0
dạy rất kỹ về kiên thức rất tận tình trong công tác giảng dạy,2
tới lớp hơi trễ,0
dạy nhiều lý thuyết khô khan khó hiểu không chú trọng giải bài tập nhiều lớp,0
đã thấy chỉ nhìn qua chưa đầy giây điểm ngay lập tức,0
chưa có một tiết thực hành nào,0
chuẩn bị tài liệu thực hành tốt,2
cần chuẩn bị phần tài liệu phù hợp hơn môn học phù hợp hơn trường,0
tài liệu ít được cập nhật,0
bài tập không quên kiến thức trong kỳ quân sự thường xuyên bài tập không ngừng giải thích chỉ rõ những cái các chỗ sai trong quá trình làm bài tập,2
môn lý kỹ thuật chỉ học lấy điểm cao kéo điểm trung bình lên thôi,1
tuyệt vời rất tận tâm đến giờ rất đúng chính xác đên từng phút giảng bài rất kỹ nhờ giảng sẵn sàng giảng giúp đỡ tận tình,2
tận tình giúp đỡ giảng dạy dễ hiểu dễ tiếp thu,2
vui vẻ kiến thức rộng sâu dạy dễ hiểu,2
có tăng thêm nhiều ví dụ minh họa lý thuyết có nhiều phần lý thuyết rất trừu tượng,2
xét về mặt ý nghĩa đúng nhưng một phương pháp khó hoàn toàn mới trong tất cả các lớp khác hướng dẫn nhiệt tình còn có nhiều không hiểu ở lạ khẳng định không thi nói câu nữa sau phục được,0
tận tâm giúp đỡ trong quá trình học,2
tận tâm nhiệt tình,2
thời lượng ít,0
hay bị trục trặc sử dụng,0
không có ổ cắm điện,0
cần cập nhật tài liệu giảng dạy tài liệu đang giảng dạy từ năm,0
sự tận tình,2
điểm danh đi học,1
nói to rõ,2
giảng bài hơi nhanh bài tập nhiều quá,0
môn học khá nặng có nhiều phần rất khó hiểu thời gian phân bố các chương cần có sự thay đổi phù hợp một số phần khá khó nhưng chỉ học trong vòng vài tiết làm rất khó hiểu,0
cần tăng thời gian môn học lên có điều kiện tiếp thu sâu hơn kiến thức,0
giọng hơi khó nghe dễ gây buồn ngủ,0
dạy đầy đủ kiến thức có liên hệ thực tế nhiều giúp hiểu rõ hơn về cách thức hoạt động những kiến thức được học,2
vui vẻ tận tâm trong bài giảng,2
cần nhiệt tình tích cực hơn nữa trong truyền đạt tới,0
mở rộng thêm các kiến thức bên ngoài,2
tạo áp lực quá lớn trong môn học đòi hỏi sự năng động sáng tạo,0
phương pháp giảng dạy giúp anh chị hiểu được vận dụng được kiến thức,2
rất nhiệt tình luôn tận tâm truyền đạt kiến thức,2
cung cấp các tài liệu tài liệu liên quan quá ít,0
nhiệt tình trong lúc dạy,2
luôn nhiệt tình có những chia sẻ rất gần gũi,2
nhưng kiến thức quá nhiều rộng truyền tải trong một thời gian ngắn nên khó nắm bắt được hết,0
bài tập nên sát đề thi hơn,0
nên đảm bảo giờ lên lớp hơn,0
giảng không hay đã còn không nhiệt tình không vui vẻ không tạo cơ hội hỏi về bài giảng,0
dạy rất vui nhiệt tình dễ hiểu bài,2
nghỉ nhiều hoặc lên lớp không có ai dạy,0
hơi khó hiểu không học trước ở nhà,0
không chỉ truyền đạt đầy đủ kiến thức còn thêm nhiều thông tin bổ ích khác,2
truyền đạt bài dễ tiếp thu,2
thường xuyên chia sẻ tình hình kinh nghiệm thực tế liên quan đến môn học,2
chỉ cần bài tập làm nộp,1
hỏi những cái cơ bản về bài học cũng không nắm kêu hỏi khác làm,0
vui tính dạy dễ hiểu tận tình,2
sử dụng hiệu quả thời gian đến lớp,2
vui vẻ giảng dạy nhiệt tình,2
nên đưa môn vào giảng dạy ngay sau môn trước học các môn chuyên ngành,0
lên lớp toàn làm,0
dạy nhiệt tình có bài tập rèn luyện,2
chưa thực sự tốt,0
cuối cùng chúc có năm mới hạnh phúc,2
bài tập phong phú đa dạng,2
giảng dạy nhiệt tình tâm huyết,2
nhờ trình lên rất nhiều sau mỗi buổi thực hành làm bài tập,2
dạy rất hay chia sẻ rất nhiều,2
xinh đẹp dạy tốt,2
nhiệt tình tận tâm chuẩn bị tài liệu đầy đủ,2
hy vọng học kỳ tiếp theo được học môn cấu trúc rời rạc,0
dạy tận tình,2
tận tâm nhiệt tình,2
kiến thức hay sự tận tâm,2
nhiệt tình dễ gần hình thức giảng dạy dễ hiểu,2
việc tổ chức các trò chơi tạo nhiều hứng thú,2
tài liệu phục vụ học tập còn ít,0
dạy dễ hiểu tận tình giải đáp thắc mắc,2
thân thiện nhiệt tình gần gũi,2
nhưng góp ý có trường hợp thực hành nên giảng sơ qua trước làm,0
dạy hay dễ hiểu có tính thực tiễn,2
tăng cường ôn tập kiểm tra làm thử các đề kiểm tra,0
trong lúc giải bài tập đến giải xong bài tập không thế hiểu được tại sao ra được kết quả cũng không biết kết quả nào chính xác ghi nhận,0
ngoài thời gian cố định trong thời khóa biểu nhà trường đều cố gắng sắp xếp đi đủ,1
giao tiếp tốt,2
còn chưa thấy mặt nữa hoặc có nhưng quên surprise,0
tăng cường một số tài liệu học cơ bản,0
giúp nâng cao được khả năng lập trình,2
dạy rất kỹ quan tâm đến,2
dạy quá tuyệt vời không còn điều gi nói,2
chưa bài tập về nhà làm nên bài mỗi chương không cần chữa chỉ cần đáp án,0
điểm làm đồ án nên trên có tính thực tiễn hơn,0
làm có tâm chút đi ạ,0
cảm ơn,1
lớp chất lượng cao nhưng thiếu thiết bị,0
nên liên hệ lý thuyết có nội dung thực hành sát nội dung giảng dạy trên lớp,0
truyền đạt dễ hiểu tận tâm,2
nhiệt tình dạy dễ hiểu,2
được điểm cũng luôn,2
giảng dạy thú vị,2
đã biết được cấu trúc dữ liệu gì,2
coi thái độ thực hành,0
bài giảng không lôi cuốn,0
nhưng học mới thấy kiến thức dạy rất hay bám sát thực tế dạy rất nhiệt tình vui vẻ khác mọi người nói,2
cần chú ý nhiều vào phân bổ thời lượng giảng dạy,0
giảng kỹ lý thuyết trước bắt đầu thực hành,2
tương tác,1
giảng dễ hiệu tận tình,2
nhiệt tình giảng dạy nhiều vấn đề rất hay cần thiết,2
bài tập thực hành thường đi trước nội dung lý thuyết được học,0
do gộp cả cấu trúc dữ liệu vào trong cùng học kỳ nên lượng kiến thức khá nhiều,0
