text,label
có nhiều chia sẻ hay về cuộc sống thông qua môn học,2
giảng bài tập nhiệt tình,2
giảng dạy tận tâm nhiều bài tập lời giải chi tiết,2
hướng dẫn rất tận tình,2
rất nhiệt tình,2
dạy dễ hiểu,2
nội dung giảng dạy lan man không sát môn học mật mã,0
bài tập ngập mặt deadline vào giờ khó đỡ,0
dạy tận tâm nhiệt tình vui vẻ,2
có bài tập,1
khối lượng lý thuyết thực hành phải học quá ôm đồm trong một môn học,0
nên bị rèm che cửa,0
hoàn toàn bình thường,1
vui vẻ giờ học vui,2
cần cải thiện thêm việc sử dụng hiệu quả có vài ứng dụng trên đấy vẫn chưa nắm được,0
nâng cấp máy chiếu máy chiếu đã mờ,0
đề thi nên dễ hơn,0
vui nhộn trong giờ học,2
đề thi ra không hợp lý,0
dạy rất tốt rất hay,2
nên có bài sửa những bài thực hành được làm hoặc giảng cách làm sau,0
truyền dạy kiến thức dễ hiểu tận tình thân thiện giúp đỡ tận tình,2
hay nghỉ dạy không có thông báo trước nhiều lần,0
dạy nhiệt tình có sự tương tác giữa người dạy học trong suốt quá trình học tập,2
dạy hơi lạc đề dạy ít ai hiểu đề bài tập bao khó đồ án bao khủng,0
nhiệt tình tui khá làm khó nhưng thế mới học,2
cần nâng cấp phòng học máy chiếu,0
vui tính nhiệt tình,2
thấy ổn ạ,1
tận tình nhiệt tình trong việc cung cấp tài liệu bài tập qua,2
tận tình tâm huyết,2
hướng dẫn thực hành rất không tốt,0
thực ra hiểu không nhiều quá đi sâu vào lý thuyết,0
đến lớp đúng giờ nói rõ ràng dễ nghe,2
đôi lúc hơi sợ,0
cách truyền đạt tốt,2
chưa cung cấp đầy đủ tài liệu môn học,0
mọi thứ đều tốt,2
học tiết nhồi nhét quá nhiều kiến thức,0
mọi thứ dạy rất mơ hồ,0
tiết học chưa được thu hút,0
cách truyền đạt kiến thức,2
tránh phương pháp đưa công thức đưa các ví dụ sinh động,2
nên nhiều ví dụ nhỏ trên lớp hơn dễ tiếp thu,0
lý thuyết tốt đồ án hay,2
tác phong chuyên nghiệp,2
cải thiện cơ sở vật chất máy chiếu trong phòng học,0
chữ rất xấu dạy khó hiểu không giải thích về bài thực hành chỉ đưa clip bảo làm theo,0
bài học rất có ích,2
thiết bị tốt,2
vui vẻ giảng dạy tận tình,2
tập trung quá nhiều vào việc xây dựng cơ sở tri thức từ nghĩ yêu cầu này phù hợp lớp giảng dạy trực tiếp được gặp hàng tuần có thể dễ dàng trao đổi,0
cần tăng cương trao đổi giữa,0
giải bài tập giúp hiểu hơn về bài học,1
nhiệt tình vui tính,2
cần thống nhất giữa chương trình lý thuyết thực hành tránh tình trạng thực hành trước lý thuyết,0
dạy rất tận tâm nhiệt tình,2
phương pháp dạy hơi nhanh có thể một số người chưa bắt kịp,0
nên nêu rõ mục đích yêu cầu môn học bắt đầu dạy nắm được mục đích yêu cầu môn học,0
giảng bài dễ hiểu thân thiện,2
có khả năng truyền đạt tốt vui tính,2
giảng bài nhựa nhựa nghe buồn ngủ,0
lịch học bù cần ghi rõ ngày nào trên khóa học,0
rất nhiệt tình giảng dễ hiểu có rất nhiều trò chơi trong giờ học giúp hiểu củng cố bài không bị nhàm chán ai nghìn phú rung chuông vàng,2
nhiệt tình tận tâm quá mức,2
ngoài việc dạy kiến thức chuyên ngành còn chia sẻ những kinh nghiệm thực tế rất bổ ích,2
nào có ý kiến muốn phát biểu tranh luận tới cùng,0
tận tâm dạy dễ hiểu vui tính lớp học thoải mái dễ tiếp thu,2
một số kiến thức chỉ được giới hạn trong khuôn khổ môn học cần phát huy thêm khả năng tìm tòi sáng tạo trong các định lý định nghĩa có sẵn,0
nên dạy đúng giáo án thời khóa biểu đừng kéo dài tới mới ra trong thời khóa biểu hết,0
tài liệu cung cấp trên website trường còn ít,0
nhiệt tình trong dạy,2
nói chung bè sau học môn nay đã từ bỏ lập trình,0
nhiệt tình kiến thức chuyên sâu thực tiễn,2
hy vọng nhiều bài tập hơn,0
hy vọng học kỳ sau có thể học,2
giảng bài kỹ,2
dạy tốt nên phát huy ngoài ra không cần cải tiến thêm đều gì,2
có kiến thức rộng giảng dạy nhiệt tình,2
hay mất rất nhiều thời gian bài học lịch học bù khá nhiều,0
lên lớp đúng giờ sử dụng thời gian đứng lớp hiệu quả,2
nên bổ xung phần thực hành,0
môn học khá khô khan,0
nghiên cứu khoa học,1
vui tính nhiệt tình,2
giao tiếp thông thường trong lớp học chưa đủ,0
hầu hết thời gian seminar,1
chưa sử dụng hệ thống,0
bài tập được đưa trên khóa học,0
nên dạy nhiều hơn nên dạy kỹ lý thuyết hơn,2
dạy rất nhiệt tình còn chưa giảng giải kỹ lắm một số thao tác còn hơi nâng cao,0
dạy rất hay rất vui,2
phòng thực hành cần có một số nâng cấp nhỏ về phần mềm lập trình cảm thấy hứng thú hơn đến học,0
nhiệt tình truyền đạt kiến thức hài hước,2
hiền tận tình,2
dạy kỹ nhiệt tình,2
cách truyền đạt không gây hứng thú,0
phần thực hành khó thường làm rất mơ hồ không hiểu ý nghĩa bài tập,0
hy vọng nhà trường cải thiện các máy trong phòng thực hành tương ứng số tiền số chỉ thực hành,0
thuyết trình làm đồ án theo nhóm nên giúp có khả nang truyền đạt kỹ năng work nhóm nâng cao,2
về cách thảo luận nhóm,1
những ví dụ dễ hiểu cụ thể,2
nhiệt tình truyền đạt hiệu quả tạo không khí học tập,2
nghỉ học quá nhiều bù học vào các ngày cuối tuần kéo dài,2
tốt,2
nhiệt tình tận tâm,2
giữa lý thuyết từ vựng trò chơi dễ tiếp thu,0
vui tính hiểu tâm lý nên giảng bài rất dễ hiểu,2
tỉ mỉ,2
rất tốt không gì không hài lòng cả,2
dạy hay tận tâm,2
rất tận tâm giảng dạy,2
nên ngày học thực hành chung ngày lý thuyết,0
thảo luận làm seminar,2
mong có thể giải tham khảo đề thi các năm hoặc các dạng câu hỏi anh văn,0
hài hước nhiệt tình,2
phải nói hiểu biết trong lĩnh vực thương mại điện tử rất rộng,2
cách thức trình bày bài giảng chưa tiếp cận được,0
đi dạy đúng giờ truyền đạt kiến thức dễ nắm bắt,2
kiến thức còn kỳ kỳ,0
cung cấp kiến thức bổ ích dễ tiếp thu,2
dạy dễ hiểu tạo cảm giác thân thiện,2
nghiêm túc lên lớp đủ xong chưa tạo được hứng thú học,0
phòng có máy điều hòa,1
nhiệt tình đưa ra nhiều trường hợp thuật toán,2
thực hành rất nhiều,2
cần bị máy nghe tốt hơn có nhiều máy nghe đã xuống cấp,0
rất dễ thương hiền nữa,2
nhiệt tình cung cấp kiến thức đầy đủ,2
hướng dẫn tận tình cung cấp đầy đủ kiến thức căn bản bộ môn,2
không lên lớp,0
lý thuyết hơi khó hiểu,0
nói chung rất thích smile,2
chia nhóm không học bên nhóm này cũng rất ít lên lớp nên không có ý kiến gì,1
do nghỉ năm nhất học quốc phòng nên quá trình học bị gián đoạn,0
thực hành,1
giảng bài kỹ dễ hiểu nhiệt tình,2
vui tính rất nhiệt tình,2
nhiệt tình giảng giải lý thuyết rõ ràng,2
tâm huyết,2
tăng hoạt động kỹ năng nói,0
các máy tính trong phòng lab nên cài đặt thêm phần mềm phục vụ việc thực hành môn này,0
chương trình giảng dạy tốt,2
đôi kẹt xe trễ giờ,0
tăng thời lượng môn học nên có thêm những hoạt động ngoại khóa có liên quan đến môn anh văn được trau dồi thêm,0
hướng dẫn đồ án hệ thống thông tin cần có thêm một vài buổi gặp mặt đưa ra lịch cố định trên trường thắc mắc có thể lên hỏi trực tiếp,0
nên thay đổi cách tính điểm môn học,0
phòng thực hành chưa có chất lượng,0
tạo động lực học tập,2
nhiệt tình vui tính tâm lý,2
cần nâng cao chất lượng cơ sở vật chất hơn,0
sáng tạo trong giảng dạy,2
dạy nhiệt tình vui vẻ,2
truyền đạt chưa tốt lan man không mang hiệu quả cao,0
rất nhiệt tình tân tâm,2
mở rộng hệ thống bài giảng,1
thích đi học tiết nhất,2
chưa đi sâu vào chuyên môn cần thiết,0
tất cả kiến thức đều hướng dẫn tận tình không tạo áp lực môn học điểm số công bằng vô tư,2
bài tập khó,0
nên thực tập nói nghe nhiều hơn,0
nhiệt tình tâm huyết đẹp trai,2
giảng rất nhiệt tình vui tính thân thiện,2
không khí học tập thoải mái hiệu quả,2
chương trình học còn khá nặng vả thời gian có hạn khó bắt kịp,0
cần giảm tải số lượng bài học trong mỗi tiết học,0
rất gần gũi,2
giảng bài hay có nhiều bài tập ví dụ ngay trên lớp,2
quá chú trọng vào phần kỹ năng nghe,0
truyền đạt kiến thức chưa thực sự tốt có nhiều lúng túng,0
dạy nhanh dễ hiểu nhấn mạnh những phần quan trọng,2
phong cách rất châu âu,2
môn nhập môn công nghệ phần mềm trước thường bắt seminar hết giờ xong có những câu nói gây mất thiện cảm thiếu trách nhiệm tuần sau thi giữa kỳ ha nội dung phần này ha mấy xem bài ha không hiểu hỏi ha chúng ta kết thúc ở ha,0
cần có một định hướng rõ trong mỗi bài thực hành tức học xong thực hành có thể áp dụng làm một sản phẩm thực tế được,0
rất hiền,1
cảm ơn hai nhà trường đã đọc,2
giang viên quá cứng nhắc,0
rất tận tình trên lớp trong định hướng,2
rất thẳng thắng trong các cuộc nói chuyện giảng bài điểm thi,2
các máy tính trường thường xuyên bị lỗi sử dụng thường phải mang laptop cá nhân lên làm bài hay thi cử,0
bị thêm thiết bị quạt đèn,0
lớp thực hành rất hay bị hủy không lý do thực hành ít tận tâm không hướng dẫn,0
cần thêm các giờ thực hành tại các công ty doanh nghiệp,0
tài liệu được biện soạn từ sách trong sách viết rất rõ ràng nhiên dịch đưa vào tài liệu gây khó hiểu đưa các ý chính vào tài liệu có vấn đề tài liệu nơi trình bày các hình ảnh các minh họa chứ không phải nơi các câu bưng từ sách ra,0
cần có thêm nhiều tài liệu phụ vụ nghiên cứu học tập,0
nhiệt tình giúp đỡ,2
dạy dễ hiểu dễ tiếp thu tập trung vài kiến thức trọng tâm,2
có những câu chuyện thú vị hì hì,2
nhẹ nhàng dễ hiểu,2
dạy hiệu quả,2
vui vẻ hòa đồng biết lắng nghe ý kiến,2
giảng dạy nhiệt tình nghiêm túc có quan tâm đến,2
có ý kiến nên ra thêm nhiều bài tập chia sẻ thêm nhiều tài liệu hơn,0
up tài liệu thông báo lên khóa học email giúp dễ nắm bắt lịch nghỉ bù có tài liệu tham khảo thêm,2
giảng dạy nhiều kiến thức,1
có một nền tảng kiến thức rất phong phú được học rất nhiều từ,2
cách trao đổi qua rất nhanh chóng gần gũi,2
nhiều không hiểu đang giảng gì surprise,0
rất tận tâm nhiệt tình gần gũi,2
giảng dạy theo đúng quy trình,1
cần thông báo cụ thể các chương thi học kỳ một cách cụ thể hơn giúp nắm được thông tin chích xác ôn tập tránh tình trạng chỉ tập trung vào các chương trọng yếu không học các chương còn,0
thường xuyên gây cười tạo hứng thú học tập,2
vui vẻ giảng dạy vui vẻ,2
trên lịch thông báo giờ học từ đầu năm thứ sắp xếp được lịch học phù hợp hơn,0
bài tập nên mang tính bắt buộc điểm cộng tạo được động lực cũng hứng thú hơn,0
cần liên hệ thực tiễn nhiều hơn,0
thử nói một nhóm không ai quen biết không chung khoa đã không cùng chí hướng lấy gì cái gọi đề ra chí hướng cách thức thực hiện chúng,0
cần phát các bài kiểm tra còn tồn động,0
nêu rõ mục tiêu mục đích môn học tiếp thu dễ dàng,0
dạy rất hay giọng nói truyền cảm dạy sâu vào các vấn đề,2
vui tính truyền đạt dễ hiểu,2
truyền đạt được ý hiểu đến,2
tạo hứng thú,2
có hơi khó khăn trong phần điểm danh vài lần vào trễ nhưng không được điểm danh,0
sửa bài chữ nhỏ quá,0
không quan tâm không hướng dẫn hết,0
giảng dạy kỹ lưỡng bài học,2
nghiêm khắc,2
môn này môn học mới chưa có đủ kiến thức truyền tải hỗ trợ tốt tới,0
thường hay nghỉ,0
dạy hay nhiệt tình giúp đỡ dễ tính sẵn sàng giải đáp mọi thắc mắc,2
không có bài tập làm thêm,0
giảng dạy nhiệt tình dễ hiểu nói chuyện rất vui thoải mái,2
hướng dẫn tận hình,2
nên tham khảo cách làm bài tập chứ đừng xem tài liệu bài tập vài giây sau qua tài liệu đáp án,0
rất chú ý nghe câu hỏi nhiệt tình giải đáp,2
dạy tốt,2
quá nhiệt tình dạy đáng thương quá,2
vui tính tích cực,2
ghi bài nhiều quá cơ cũng rất tốt smile,2
sau đã học xong môn nhập môn điện tử thiết nghĩ môn học này cần có thêm những phần học về thực tế có thêm động lực học những phần lý thuyết đôi khô khan xa lạ đồng thời tạo được sự đam mê bộ môn điện tử nói chung ngay từ những ngày đầu học nhập môn,0
tương tác nhiều,2
rất trẻ cập nhật từ ngữ trẻ rất nhanh,2
chia sẻ nhiều điều hay,2
quá tập trung vào tài liệu,0
cần nghiêm khắc hơn trong quá trình học,0
thương xuyên chỉ dẫn trên,2
cần lên lớp thường xuyên hơn dạy những kiến thức thiết thực môn học hơn,0
đề thi giữa kỳ do ra có câu trắc nghiệm nhưng có câu ra sai đáp án trong có câu không biết câu nào sai sao sai phần tự luận ra sai câu,0
nội dung giảng dạy còn sơ sài,0
ngôn ngữ thực hành nên bị trước,0
tiết học vui vẻ,2
cảm thấy hài lòng môn này,2
dạy chậm,0
phòng học microphone máy chiếu cần nâng cấp cải thiện bảo trì thường xuyên hơn,0
cảm cảm thấy không cần thiết thay vào các lớp kỹ năng hay học thuật tốt hơn,0
phòng máy chất lượng khá cùi nhiều máy không có,0
nên giảng kỹ chi tiết từng bài nhiều bài đa số chưa hiểu giảng nhanh chuyển qua bài khác,0
môn giải tích một môn khô khan nhưng dạy rất dễ hiểu,2
thường xuyên mang ví dụ vấn đề thực tiễn vào bài giảng,2
góp ý nhắc nhở nhiệt tình lưu ý sai sót,2
tận tình dạy dễ hiểu,2
dạy ngắn gọn không lan man,2
cần sử dụng microphone giảng bài lớp khá đông,0
mới chỉ giới thiệu phương pháp không dạy cách sử dụng phương pháp,0
khả năng tương tác chưa tốt,0
giảng dạy rất kỹ càng,2
có kết hơp ví dụ giải bài tập trên lớp hài lòng,2
gần gũi tận tình,2
có nhiều hình thức giảng dạy hay,2
ý rất ít tới có thắc mắc chỉ trả lời qua,0
tăng hiệu suất máy tính,1
nhận thấy môn này học xong hầu vẽ mô hình thi cuối kỳ cũng vẽ mô hình toàn tập,0
những thứ không đủ làm bài thực hành tuần tuần tuần,0
rất thường xuyên kể về các câu chuyện cá nhân mặc không nào yêu cầu quan tâm,0
chưa đưa được nhiều bài tập,0
kiến thức uyên bác hài hước hay kể chuyện,2
nên tăng cường luyện nói trên lớp hướng dẫn cách nói nhanh lưu loát,0
nhiệt tình thân thiện,2
thấy nên bỏ môn học này,0
phòng thực hành quá kém chất lượng máy móc không đảm bảo,0
gần gũi hòa đồng,2
giảng dạy tâm huyết có nhiều cách sáng tạo giảng dạy,2
tận tâm nhiệt tình nghiêm khắc giảng bài dễ hiểu đánh giá kết quả học tập công tâm chính xác,2
dạy tận tình tạo không khí mới mẻ buổi học,2
giảng dạy hay rất nhiệt tình tài liệu bài giảng chuẩn bị tốt,2
chú tâm hướng dẫn từng tương đối dễ hiểu,2
dạy hay nhiệt tình,2
dạy rất kỹ,2
tận tâm nhiệt tình giúp đỡ,2
bài tập sát nội dung giảng giải dễ hiểu,2
cần chú ý quan sát hơn hỏi xem nào chưa hiểu,0
giải thích chi tiết các phần khó hiểu,2
giảng bài một chưa tương tác,0
rất mong nhà trường nâng cấp phòng máy máy mở lên rất lâu màn hình bị nháy con chuột bị đơ bàn phím rít nên cài cao hơn dễ thực hành,0
mong giúp đỡ nhiều hơn,0
mỗi ngày đi học kinh tế đại cương một niền vui,2
dạy rất tận tình dễ hiểu truyền đạt tốt,2
không hỗ trợ giảng bài chính bận,0
lên lớp đầy đủ đúng giờ,2
do việc có khác vào dạy thế trong khoảng sau giữa kỳ nên đã xảy ra một số nhầm lẫn về bài học cách thức tính điểm đồ án nên dẫn đến một số bị điểm thấp,0
thường xuyên không lên lớp vào tiết dạy,0
dạy rất tốt,2
phòng học nhỏ không đủ máy không kết nối mạng trong phòng thực hành khoa mạng máy tính,0
có các hoạt động phù hợp nội dung bài học tận tâm nhiệt tình,2
thường xuyên bận việc đột xuất báo nghỉ sát giờ,0
nội dung giảng dạy nửa đầu học kỳ khá mơ hồ làm thế nào thành công thói quen người thành công hay bàn về tương lai,0
vui tính dạy rất dễ hiểu rất nhiệt tình,2
nói chuyện dễ nghe,2
hướng dẫn giảng dạy,1
tài liệu học tập một website lên tự học làm đồ án,0
thời gian học tập luôn thiếu sót chưa nhiệt tình giảng dạy,0
dễ hiểu nhiệt tình,2
đưa ra những dạng bài hay bao quát kiến thức,2
lý thuyết môn thực hành không song song thực hành thường trước lý thuyết,0
giảng dạy kỹ trình bày logic,2
dạy quá nhanh làm mức độ hiểu bài chỉ thêm hạn hẹp,0
còn kiểm tra nên thuyết trình hoặc làm đề tài hay nhất đừng làm mấy bài kiểm tra làm chi vừa chẳng khẳng định được người có kỹ năng chưa chỉ chạy theo chỉ tiêu nhồi sọ,0
tận tâm nhiệt tình,2
khá giống lúc học phổ thông,1
tăng cường thêm thiết bị môn học được hiệu quả,0
có cũng xin xem chất lượng môn này,0
giảng dạy chi tiết,2
nên thu nhỏ lớp học,0
nên đổi mới phương pháp giảng dạy tránh thô cứng không hấp dẫn,0
làm bài tập kiểm tra bài thường xuyên,2
nên mỗi thành viên trong nhóm làm báo cáo riêng không ai thiệt thòi ỷ,0
điều rất khó chịu trong khoảng thời gian quản lý thực hành bài tập thời gian lúc nào cũng phải gấp hơn lớp còn,0
vui tính tận tình cách giảng giải dễ hiểu,2
bài tập giảng dạy chưa kỹ,0
nên đổi mới cách dạy bài học trở nên sinh động hơn,0
cách dạy khoa học,2
dạy khó hiểu không tận tâm,0
giảng dạy dễ hiểu có tâm,2
giảng viến quan tâm nhiều đến,2
đúng luôn hi hi,1
dạy hơi buồn ngủ,0
không có điều gì không hài lòng,2
điểm công bằng,2
đề hơi khó thực tế,0
đầy đủ kiến thức,2
dạy dễ hiểu bài tập đa dạng,2
nên tạo động lực tham gia năng nổ đóng góp buổi học,0
đến đúng giờ giảng bài khá dễ hiểu,2
giảng dễ hiểu thu hút hấp dẫn,2
giảng dạy nhiệt tình phương pháp dạy hay chỉ dẫn hiệu quả,2
dạy nhiệt tình quan tâm đến,2
dạy tốt nhiều bài tập,2
rất dễ thương smile,2
dạy hay mang tính thực tế,2
vui vẻ nhiệt tình hòa đồng,2
truyền đạt quá không tốt,0
nhiều bài tập hướng dẫn giải rõ ràng,2
nói giọng to rõ ràng,2
nên giải thích một số vấn đề khó chi tiết hơn,0
không thể nộp bài viết luận qua email vẫn phải nộp bài bằng giấy viết tay khá mất thời gian,0
rất vui vẻ tâm huyết nhiệt tình,2
giảng dạy quá mập mờ ít lắng nghe ý kiến,0
thường giờ kém mới bắt đầu học,0
quan tâm đến học giảng dạy tận tâm dễ hiểu,2
sự cố này kéo dài hơn một tháng mới chấm dứt,0
đồ án làm rất mơ hồ đa số không thể hiểu được đang yêu cầu làm gì,0
rất hiền,2
giảng hơi nhanh một số phần,0
tăng cường thời lượng giải bài tập,0
nên đưa ra một số bài tập giải mẫu,0
quá nhiều kiến thức cần nắm nhưng thời gian có hạn,1
luyện hơi ít bài tập,0
giảng dạy nhiệt tình tận tụy hết công việc,2
tạo sự thu hút,2
nội dung thi khó không chuyên,0
chia nhỏ điểm ra mỗi buổi bài lab nộp bài lab lấy điểm,0
lớn tuổi nói nhỏ không sử dụng tài liệu trình chiếu,0
phòng học thực hành không đảm bảo chất lượng việc học thực hành,0
dạy rất nhiệt tình tận tâm chỉ bảo,2
nhiệt tình giảng dạy truyền đạt kiến thức,2
chưa dạy cách áp dụng môn học vào thực tiễn,0
có thể lên lớp đúng giờ tuyệt ạ,0
tận tâm nhiệt tình dạy sát nội dung môn học,2
nhiệt tình phương pháp giảng bài dễ hiểu,2
cung cấp tài liệu học tập rất đầy đủ chi tiết,2
có liên hệ thực tế qua bài giảng giúp nhanh tiếp thu kiến thức,2
kính mong quý có thể thay đổi,0
không thấy trên lớp,0
giảng hay truyền cảm hứng tạo hứng thú nghe giảng,2
rất dễ gần nhiệt tình chỉ bảo,2
phòng học được sắp xếp gần nơi thi công ồn ào không học được,0
dạy rất tốt rất vui,2
môn học tạo quá nhiều sự mơ hồ,0
cần đảm bảo giờ học trên lớp hiệu quả hơn,0
sĩ số trong lớp quá đông nhiều nhiều ngành khác nhau học nên chất lượng buổi học không tốt,0
chú trọng giao tiếp,1
chỉ môn game học hai lần không qua quả thật rất không hài lòng những lý do vô cùng thiếu chuyên nghiệp thế này,0
dạy nhiệt tình mẫu tham khảo,2
tốt giỏi chu đáo,2
sự nhiệt tình tận tâm,2
giảng bài hơi chậm,0
biết rõ sự chênh lệch về trình độ giữa khóa khóa trong lớp nên đưa ra cách đánh giá hợp lý nói rõ điểm mạnh điểm yếu nhóm sau mỗi lần báo cáo,0
nói dễ nghe,2
phòng máy cần nâng cấp,0
hoạt động nhóm tốt giúp tích cực,2
nên hướng dẫn thực hành thay ngồi im giám thị gác thi thực hành,0
rất thú vị,2
thật chất không học này,1
không hề thấy đứng lớp,0
dạy vui vẻ,2
điều hài lòng nhất đi rất đúng giờ không dạy quá nhanh,2
chính tuân thủ tài liệu nên không thể vượt qua bài cờ tướng số điểm mong muốn,0
phân bố chương trình bài khá dài,0
cách giảng khá dễ hiểu nên đừng lo quá về vấn đề ạ đa phần thụ động nên không hiểu càng không dám hỏi,2
nên tập trung vào kỹ năng nghe nói nhiều hơn,0
chưa nói rõ có thể hiểu rõ,0
nhẹ nhàng từ tốn,2
những bài tập về nhà khó hy vọng có bài sửa mẫu chi tiết cả lớp giúp rút kinh nghiệm ạ,0
dạy rất dễ hiểu hài hước,2
có cách làm đồ án quay video clip rất hay vừa vui vừa cách tìm hiểu kiến thức một cách mới hứng thú,2
thẳng thắn kiên quyết,2
cần thêm tiết học thực hành,0
một người sống rất có tâm có vẻ bề ngoài đẹp trai rất hóm hỉnh dí dỏm,2
phần mềm phục vụ phần thực hành không được cài đặt đầy đủ trên tất cả các máy tính,0
theo thời khóa biểu mỗi buổi tiết nhưng chưa bao giờ dạy hơn tiết buổi hay kể chuyện kiếm hiệp trong giờ học,0
nên nhanh chóng đưa thiết bị thật vào thực hành,0
có thể tổ chức mỗi tuần một vài tiếng việc hỏi trả lời các thắc mắc hướng dẫn tốt hơn có thể tổ chức trên mạng các trò chuyện,0
vui tính hay kể chuyện cười,2
phương pháp đánh giá kết quả không hợp lý nội dung đề ra môn học,0
dạy rất vui rất nhiệt tình,2
cần chủ động hơn trong việc dạy dạy bù hỏi về lịch dạy bù hầu hết được hỏi đều không biết,0
tạo không gian học tập vui vẻ,2
truyền thụ hết kiến thức,2
